{
  "schema_version": "v1",
  "direction": "inbound",
  "product_boundary": "evidence_and_procedure_request_only",
  "request_id": "22222222-2222-4222-8222-222222222222",
  "tenant_id": "11111111-1111-4111-8111-111111111111",
  "campaign_id": "campaign-antigua-2027",
  "community_id": "community-san-mateo",
  "question": "¿Qué evidencia y procedimiento aplican para llevar agua potable a la comunidad?",
  "jurisdiction": "Municipio de La Antigua Guatemala, Sacatepéquez, Guatemala",
  "case_context": {
    "subject_reference": "water-case-san-mateo",
    "community_id": "community-san-mateo",
    "facts": [
      "La comunidad reporta necesidad de acceso a agua potable."
    ],
    "provided_documents": [],
    "constraints": [
      "No inventar formularios, plazos ni sistemas."
    ]
  },
  "requested_depth": "deep_dive",
  "requested_output": "procedure_workflow",
  "provenance": {
    "source_product": "os_electoral",
    "generated_by": "integration_client",
    "created_at": "2026-07-18T18:00:00Z",
    "source_refs": [
      "campaign-antigua-2027",
      "community-san-mateo"
    ],
    "credential_id": "33333333-3333-4333-8333-333333333333",
    "audit_id": "44444444-4444-4444-8444-444444444444"
  }
}
